text,rating,item_reviewed,publisher,date_published
"great priced clothes, which are always in fashion I have shopped here since my children were babies, they never fail for good quality cheap fashionable clothing.

It washes well too and doesn't loose its shape or colour",5,Primark,trustpilot,2011-11-04
Recently bought a pair of long johns… Recently bought a pair of long johns for my husband in medium as I have bought medium before and they was really good size but this time I got home and I could tell they wouldn't fit so I left them in the packaging and tried to return  and they refuse my refund so I have to throw them in the bin as they were no good so thanks Primark for nothing as I will remember that next time I am out shopping and remember you're not very good at refunds even though the garment hasn't been tried on or taking out the packaging,1,Primark,trustpilot,2021-07-14
Primark in oxford st Primark in oxford st has a very depressing atmosphere coming off the staff which soon goes to the public.Also there is slow service at the cashier point.However there clothes were average,2,Primark,trustpilot,2017-08-12
"Awful Online Customer Service I don't live close to a Primark store and my closest is at least 40 minutes away, I can't drive and I don't have the resources to get there just to return one item. While on a trip into Coventry I went into a Primark store and purchased some items that I had before and they lasted very well hence why I wanted to buy them again. I got them home and wore them once and they broke. I then sent an email to Primark about this and I have just received a reply. The reply was completely dismissive of the issue and how far away I live, I just got a generic reply stating that I have to return it to a store. 

Very very disappointed with Primark and I will be avoiding them in future and advise others to do the same unless you don't mind wasting money on faulty items.",1,Primark,trustpilot,2015-04-10
Such good staff such good staff.  lj is good,5,Primark,trustpilot,2015-12-19
"Bought a 3 pairs of Ripped Jeans Bought a 3 pairs of Ripped Jeans, didn't try 1 of them on for a few weeks, then found for some reason they were to tight, Primark refused to exchange them as I had mislaid the receipt, so I am stuck with jeans that I cannot wear, proper rip off, It felt like I had been mugged.
To add insult to injury, they asked how I would like to pay for the pair I had picked up to replace them(after trying them on) .

I contacted their customer services, and they more or less said Tuff.",1,Primark,trustpilot,2019-04-18
"Cheap is not always good Clothes last 5 washes tops and walking into a Primark shop it like trying to wade through a 14 year old boys bedroom...stuff absolutely everywhere.  Untidy, frustrating and terrible quality.",1,Primark,trustpilot,2011-11-02
"bad service bad service, poor qualiy",1,Primark,trustpilot,2020-05-11
So why does it cost more to send a gift… So why does it cost more to send a gift card the more you spend? That is crazy. Even if it was royal mail special delivery the price wouldn't change from £1 to £500 of value!! On principal I would rather give a prepaid credit card to spend anywhere,1,Primark,trustpilot,2019-12-09
"Went to exchange a Christmas present… Went to exchange a Christmas present for a larger size and was unable to exchange as I did not have the receipt or gift receipt.  Did not know that Primark did gift receipts.  No staff mentioned it when I brought Christmas presents either. 
Anyone else had this problem?",2,Primark,trustpilot,2021-12-27
"Managers are rude and security very intimidating I've been into the NEW CARLISLE store a couple of times now and it's hard to push a baby in a pram at the best of times never mind holding a basket in a busy store! So I decided to balance the items I later purchased on top of my pram! Every where I looked I was being followed by the security guard even when I went upstairs I thought I was just been paranoid but when I returned a few days later he was doing the same thing and also sending signals to other staff members to watch me! I've worked in retail all my life and I always pay for my goods! I'm so embarrassed! To make things worse I was in the large long que with my baby and when I asked a member of staff if I could use the quick smaller till as I was near it and just had 1 small item to buy and my son was getting distressed because it was really hot, she was polite and said yes but then a manager (small male in a Christmas jumper) came over and told me to stand and wait in the que with the others! Like I was a bloody animal!! I was even more embarrassed with my son crying! I won't be going back I would rather pay more for the customer service in other shops!",1,Primark,trustpilot,2016-12-20
I love primark I love primark i am always satisfied with my buys but i wish there was more of them placed around the closest one to me is in Leeds about 20 minutes away from where i live and i don't drive great quality and cheap prices wish there was more primark stores dotted around England im also annoyed because they don't have a website which you can order from.,4,Primark,trustpilot,2015-02-22
"Always shop at Primark in Leeds and… Always shop at Primark in Leeds and Bradford, staff friendly, prices cheaper than other stores, excellent customer service",5,Primark,trustpilot,2021-04-14
"Paranoid sales staff. Lack of training. One of the sales assistants at the stockport branch is paranoid! She was very suspicious when I paid for my shopping in cash. I think she was not trained in recognising fake Five pound notes and decided to hold me up at the til like a criminal until her manager arrived to confirm that my five pound note was genuine. What a daft woman serving at the til, possible racist as I think if I had been a white British customer she wouldn't have made a silly fuss. Primark need to train their staff on how to recognise fake notes instead of treating customers like criminals and embarassing them. Not happy with how I was made to feel on what was meant to be a happy shopping spree. Talk about spoiling someones shopping experience! Won't be shopping there again.",1,Primark,trustpilot,2018-04-03
PRIMARK ABSOLUTE LOVE PRIMARK ESPECIALLY FOR THE YOUNGER ONES IF YOU LOOK YOU GET SOME REAL BARGAINS,4,Primark,trustpilot,2012-04-01
"low prices and lower quality primark are popular because of their low prices and good clothes, I beg to differ on the 'good clothes' aspect. 



Labour is driven by slave trade abroad and the clothes don't last as long as clothes should. Customers are only happy because they can go back and buy another hand-made-by-child garment then the current one inevitably breaks.",2,Primark,trustpilot,2012-02-11
"I took a sports bra back to Lancaster… I took a sports bra back to Lancaster primark, and needed a bigger size ,the staff were very unhelpful as I had no receipt but had full tags on,I’d spent 60 pounds a few days before,under these stressful times were you Carnt try on ,you would think the staff would be more sympathetic,I’ll take my 60 pounds else were next time ,unprofessional staff ,I wouldn’t employ them disgusting",1,Primark,trustpilot,2021-04-21
Primark broughton 27/03/19 I am really disappointed with the customer service I received today. I spend £40 + two days ago and unfortunately lost my reciept. An item I bought my daughter was on the wrong hanger and it was huge on her. I asked could I exchange it for the correct size and they wouldn’t let me without the receipt. I work in retail myself and just find it awful customer service. I was made to feel like a thief even proving on a bank statement I had spend over £40 two days earlier. I really think you need to change your policies primark I won’t be shopping here again that’s for sure. I would understand if I was trying to get money back etc but it was a straight exchange for a smaller size,1,Primark,trustpilot,2019-03-27
"Love love love the homeware shame about the layout Love love love the homeware, my only negative is that the layout of my local store is very in-wheelchair friendly with aisles you can't go down if there's another customer in it, tight corners, things stuck out at low level and even the queueing system - if you take a wheelchair through it no customer can get past making it feel very awkward and like you're in the way.",3,Primark,trustpilot,2017-04-04
"i love primark I didnt know primark had a website till I saw it on here, I just love shopping in primark, great value clothes, brilliant",5,Primark,trustpilot,2012-02-18
"I love Primark but it's in store shopping is a disaster! I love Primark in-store shopping, it is one of my favourite shops; the online shopping is terrible,this is because it is complicated and when you click on a subcategory e.g.:women's,dresses,it barely comes up with any choices(3 online) whereas in store there would be more of each.",3,Primark,trustpilot,2018-10-23
"Great clothes website Primark offer a huge range of there products on there website, so much so, I think it may be there entire stock list. This is quite rare, as most retailers of clothers, list only the Sale items or items that need to be cleared from stock.



My Wife loves the shop, I love the shop. Well done Primark, exceptional value for money and a great website to match.",5,Primark,trustpilot,2011-09-19
"Brilliant They have exactly the size i wear, which is pretty small",5,Primark,trustpilot,2012-04-23
"Pink clay mask. Bought a face mask for 80p expected average but got a disgusting acid like mask . We washed it off immediately, my skin burned and went red and raw. Never buying this mask again. Never buy the pore refining pink clay mask. Take this of the shelves immediately. I demand you take this into consideration.",1,Primark,trustpilot,2020-02-20
"Returns policy Returns policy 
Although I appreciate it is not legally obliged to do so, in the interests of goodwill, I would have appreciated a bit of discretion by the store manager when I tried to exchange something 1 week outside the 30 day period.",2,Primark,trustpilot,2018-11-15
"Lots of cheap clothing Lots of cheap clothing, service can be hard to get hold of but when you do staff are helpful.",4,Primark,trustpilot,2021-09-04
"Canterbury Branch Canterbury Branch 

EDIT; I’ve changed my review from 4 stars to 2 stars after today’s visit. And to be honest that’s only because one single member of staff was able to help me find my jacket I was looking to purchase for my daughter. If it wasn’t for her this would be a 1 star review. Today’s visit was met with staff swearing, using trolleys blocking aisles, total lack of manners no ‘excuse me’, most of them have an attitude and are rude. Let yourselves down today....big time 

Always lived primark and this is one of the better maintained branches. Always tidy and despite being an incredibly busy store. 

Would be 5 stars if they put more staff on the  till sometimes as usually a full queue. And the staff work so hard to clear it quickly. 

More space surrounding the make and toiletries area as it’s always so packed and no space to move past anyone. 

Clothes well priced and love a bargain, just please please please stop moving everything every week. Can never find anything again and I end up leaving without it. 😥.",2,Primark,trustpilot,2019-12-02
"Terrible customer service After buying £100 worth of stock from the Birmingham branch. I visited the Hereford store to return three items. All full price,  All with tags and labels attached and with a receipt. The older women who served me at the customer service desk was extremely rude! No hello, no conversation at all. I had to wait whilst she hung up the three items. And inspected them each for about three minutes. I was already in a rush and she purposely took her time!  All she stated was not to buy the products unless I wanted to keep them.   She would not exchange for items I had I’m my hand. I had to go back to the tills. I will not be visiting Hereford Primark again! Terrible customer service.",1,Primark,trustpilot,2020-02-25
"Poor quality Fun to look around but beware.  The goods do not last long at all, fit badly and the queues are horrible.  The stupid paper bags fall to bits on the way home and the jewellery is often broken before you even wear it.  For the price George is way better value.  I think primark is mainly a young persons store.  Even then my 15 year old is often disapointed with the stuff she buys. Its a junk shop really.",2,Primark,trustpilot,2012-05-15
"Bristol Primark I visited Bristol Primark on Saturday and had a good experience. The shop was well stocked, with most sizes available in the things we were looking for. My son was very happy with his new clothes. On a side note, I completely understand the no receipt no refund/exchange policy. I cannot understand why there are so many bad reviews from people who lost their receipts. You shouldn’t leave a negative review for something that is your own fault.",5,Primark,trustpilot,2021-05-04
The price is right I love Primark simply because this is how much I think clothes should cost. Having a mother who is a seamstress I have always been aware of how much it costs to make clothes and I simply refuse to pay overinflated prices for items of clothing. I have noticed the prices in Primark creeping up slowly. But some items like jeans and shoes still remain very low. The items I purchase in Primark are of good quality.,5,Primark,trustpilot,2011-07-29
Purchased my daughter a £10 handbag… Purchased my daughter a £10 handbag which broke after a week took it back to the Hastings store with my proof of purchase only to be told tough basically they weren’t doing anything about it as my proof of purchase could of related to anything at all that was purchased from the store. !!!! What a total joke proof of purchase surely is proof of purchasing items from the store. So when your are told tough it could relate to any item from the shop I think they now are asking for video evidence. What a load of rubbish and bad attitudes buy honestly and get treated like fraudster. Avoid this shop unless you have video evidence of the actual purchase taking place. They will want blood next.,1,Primark,trustpilot,2019-10-17
"Leeds Thank you for employing my illegal sister, she don't have to work the streets now

Polish love UK Money 🇵🇱",5,Primark,trustpilot,2020-08-30
Perfect Perfect Value for money!,5,Primark,trustpilot,2019-06-30
creepy security guards i went shopping… creepy security guards i went shopping yesterday in your Brighton store on leaving one of your security staff decided not only to accuse me and my 2 year old stealing even though she had nothing in her had and nothing in the basket in the buggy but decided he had the power to grab me yet there is a pandemic going i=on and to lean over my daughter in the pram and have his head at her leg level this is vile,1,Primark,trustpilot,2021-06-24
"Great for cheap 'throwaway' clothing & accessories Great price for upto date throwaway fasion, their items were not made to last more than 1 season and their basics such as t-shirts and underwear is great value. stores can look a bit like a jumblesale on a busy Saturday. It would be great if they developed an online store too.",4,Primark,trustpilot,2012-03-01
"Website needs improving I love going in store to purchase budget fashion, however their website needs drastic improvement. It’s terrible. There are posts on there from last December & an item I was looking for, that’s listed as in stock now, no one knew about.",3,Primark,trustpilot,2017-12-07
"Cheap prices, wrong sizes. Cheap prices but their sizes are quite random, who knows what they actually are when they are called XL, M, L XXL, S. There is no indication of the actual measurements which means you try stuff on at home and it doesn't fit and you have to take it back for a refund, wasting a lot of time and effort. They should get rid of these measurements and replace them with actual sizes.",4,Primark,trustpilot,2017-03-30
"Terrible returns and exchanges policy Terrible returns and exchanges policy! I purchased a top that is could not try on due to covid. Got home and when I got round to wearing it, realised it was TOO BIG! I then had to self isolate bla bla and on my first trip out I went to exchange it. As I am a few days out of the returns policy the manager refused to help and said the receipt had expired and would not help me but told me to contact head office, which I did. I explained the situation to them but they have also said I can not exchange the item, even for a smaller size because I am out of their policy. Even mid pandemic when all the other shops have amended their policies to understand customers are not always able to meet these stringent guidelines, primark will still not help. Will find every social media platform now to complain.",1,Primark,trustpilot,2021-08-07
"I LOVE PRIMARNI!! I have to say i love primark more than any other clothes retail outlet. The shoes clothes and underwear last a while and the prices are impossible to beat! The staff are mostly friendly and my only criticism is that sometimes it looks like a bit of a jumble sale, but i do have fun sifting through for my bargains!",5,Primark,trustpilot,2012-01-09
"Has there ever been a company with more unhappy staff. Unfortunately, the staff in this company just don't really look or sound like they are happy to help. Very rarely get smile from the at check out. clothes get screwed up and thrown into a bog on the floor. The isles next to the cashiers look like a jumble sale. The door staff/security when you enter or leave the store, look at you as if you with such disdain that you really don't feel like entering the store.",2,Primark,trustpilot,2017-11-09
"Primark made me cry..... Please Read!!! Please Read!!!! Please Read!!! Please Read!!!!!

Has anyone ever experienced customer service so good that it made you cry?

I have!! Primark, you are truly the most incredible company with the most amazing employees.

I Am getting married in a few months, and I needed 6 x mens 3 piece suits. So I set about finding some, and I couldn't believe the nicest ones I found were at primark priced at only £50 each for the trousers, jacket and waistcoat! such an amazing deal.

I took all of the suit sizes from the groomsmen, and set about buying them...but I couldnt find just one jacket in a size 46R.

I called a few stores, and although they were extremley helpful, there were none available.

So I emailed Primark head office, I explained my situation and my upcoming wedding.... What happened next has floored me!

A customer service coordinator (Lisa Fox) replied, She had contaacted all the stores and revealed that there were no longer any of those Jackets in stock..anywhere!

She went on to explain she had contacted the people that supply these suits, she was told they were discontinued, so she had arranged with them to have one specially made and sent to me..free of charge!! The jacket arrived today in a large box, the jacket was hanging up in the box and attached was a card. I opened the envelope, and there was a beautiful 'greeting card saying 'We wish you all the very best on your wedding day' I am not a softie, and I do not cry, but in this case, my eyes did glaze, I was choked and I had goosebumps, You are all amazing at Primark, and I will tell everyone I know about how wonderful you are.",5,Primark,trustpilot,2015-11-16
"I was denied entry because I had my Brompton fold up bike I have been shopping at Primark for a very long time and unfortunately this morning’s experience at Primark in Ealing Broadway London was shocking. I was not allowed entry with my fold up Brompton Bike in the store. The security who was on duty denied access. I didn’t want to create a big scene, hence I just left. I was allowed entry to the rest of the other stores in Ealing Broadway except Primark!!",1,Primark,trustpilot,2021-06-26
"Size 8/10 please I’ve still given a 5 star rating as I love Primark but why change the sizes??? I am a size 8/10, I’m not 6/8 or 10/12 
Please, please revert back, I’m not the only one who is complaining.",5,Primark,trustpilot,2021-04-19
"Saturday 28th September I went to Primark today (Saturday 28th September) and oh my was it appaling! 
The bag was lopsided and ripped all over so it was difficult to put clothes in and even just get the top item out! 
The fitting rooms where awful, I was told I couldn't go in without taking everything out of my bag because I couldn't take the bag in! Then when u tried and finally managed to get the clothes out the worker expected me to magically have a hand free to hold the extra white hanger that says how much I've got! Plus! When I got into a booth there was dust everywhere, clothes stickers stuck on the ground and the curtain was so stiff it hardly closed or even opened to begin with!
It only got more difficult when I realized that my previous purchase a few weeks before that was separate pins saying 'Trick' 'Or' 'Trick' was sold to me when it was supposed to say 'Trick' 'Or' 'Treat', that may be my fault but all the pins in that Primark said the same thing, so I didn't know any better.

All in all, not a good experience.",1,Primark,trustpilot,2019-09-28
"Love it I always love the clothes I buy from Primark, sometimes i need to return them for a refund but with my receipt I can do this easily. :)",4,Primark,trustpilot,2021-10-12
Online is buggy but going in store it’s… Online is buggy but going in store it’s cheap and fashionable,5,Primark,trustpilot,2019-12-27
"Exchange policy Hey Primark, no exchange without a receipt betrays a lack of respect for your customers. It costs nothing to swap a size for someone but leaving them stuck with a useless item is losing you a lot of good will based on these reviews. Poor level of service compared to other retailers and I bet your staff would be relieved if you changed it.",2,Primark,trustpilot,2021-11-17
So disappointed that I couldn’t… So disappointed that I couldn’t exchange my son’s jeans for a size smaller just because I didn’t have the receipt which was lost in the paper bag due to torrential rain. The jeans still had all labels on and I was able to show my (Nhs Visa card) proving purchase on my phone app but absolutely no flexibility at all despite no facilities for trying clothes on due to covid 19. Really poor service- no compromise at a time when we all need to show understanding- shame on you Primark,1,Primark,trustpilot,2020-08-02
Quality not all that and there prices have gone up i went to buy some bits in primark the other day and was suprised how much items have gone up in price. sometimes its not worth spending it in primark now when you can go elsewhere and get better quality thats going to last longer. on the plus side you can still get some great bits,3,Primark,trustpilot,2012-04-05
"Cheap fabric for the weekend. Have purchased several items due to adverts and friends talking about Primark. The fabric is poor quality often badly made, minimal stitching etc. Pretty much all items are not for long term wear and pretty disposable. So if you want something that you can chuck after a messy fun weekend then this is the stuff. if you want it to last more than a few months of regular weekend wear then forget it. If your kids are fast growing or often wrecking cloths with play then I would recommend this stuff. As for me I will be spending my cash on something a little more lasting and would not buy anything else primark do because of what I have seen so far.",1,Primark,trustpilot,2011-08-02
"Shopping in the Yeovil Primark Store in … Shopping in the Yeovil Primark Store in mens wear Dept. I had the pleasure of meeting a lovely lady called Sue. She was most helpful and very knowledgeable about the store, I did my shopping in half the time. She even keep back a pair of shoes for me when the right size came in. Thank you Sue very much appreciated. 
Regards.
Ken.",4,Primark,trustpilot,2017-06-04
"keep up the good work keep up the good work, respectful and professional",5,Primark,trustpilot,2021-06-11
On the 13th of October I went to the… On the 13th of October I went to the Lewisham store my friend had sent me 2 dresses she's 75 and couldn't find receipt I only wanted to exchange I had £88 worth of shopping in my basket that I was going to buy along with exchange they wouldn't let me exchange the dresses so now I have 2 dresses that don't fit and my friend a pensioner is buying me another gift as a sorry called he head office said someone would call me back but they haven't will never shop in there again think it's disgusting and I will make this go viral,1,Primark,trustpilot,2021-10-14
"Customer service pay you off with a voucher but don't give answers I was in the Birmingham store in January making a purchase, stood at the tills for nearly fifteen minutes more members of staff messing around the till area rather than serving. When I got to the till I enquirer about the pricing of my purchase as I had previously bought it in another store in the sale however in this store it was a pound more. Then when I left the security guard stopped the escatlor when a number of customer were on it. I emailed Primark and raised my three concerns and was told I would be written to in due course and received a gift voucher and no expection so I emailed again to no reply. I used my gift voucher in the Oxford street store in London and had the same type of service at the till point far to many members of staff talking around the till points and not actually doing anything. And not necessary talking in the English language either. I'm done with primark. Never got a conclusion all response and nearly September still waiting a reply end of september, nearly November and still no reply",1,Primark,trustpilot,2016-10-30
