text,rating,item_reviewed,publisher,date_published
Primark in Sutton Surrey has the rudest… Primark in Sutton Surrey has the rudest manager I have ever come across I have no idea how she got the job and is still in the job,1,Primark,trustpilot,2021-12-26
"It would seem I'm not on my own in… It would seem I'm not on my own in losing a reciept (the cat actually destroyed it) and not being able to return or exchange items. Because we are not allowed to try anything on at the moment, I had a few things that didnt fit. I spent £130 and took the items back with tags still on 7 days later.  There was no good will or even good manners from the staff at the Bradford branch when I offered to show bank statements to prove I did buy the stuff. I won't buy another thing in that shop again .  Maybe Primark should consider email receipts like other stores",1,Primark,trustpilot,2020-10-08
"Coercing our tenagers into a untested… Coercing our tenagers into a untested that has killed over 1500 people and had over 1 million serious side effects , dont beleive it ? Check out the governments own yellow card system online promoting this jab is not what a retail store is about, stay out of peoples medical decisions !!!
will boycott",1,Primark,trustpilot,2021-08-23
"Recently bought to packs of boxers from… Recently bought to packs of boxers from them. Correct size, and they fit well. But noticed this morning. That the seems at the front are starting to pull and tear. This after only a few times worn!
Extremely poor quality. Won't be buying from them again. I'd rather pay the extra for quality that's going to last. Than buy this sweat shop rubbish. Primark is what it is for cheaper clothes. But this is extremely poor quality.",1,Primark,trustpilot,2021-08-22
"Very good Competative prices

Shops are messy, like a jumble sale",3,Primark,trustpilot,2011-09-16
good for the essentials but queue's are a given cant beat it for the general essentials and non branded goods...number 1 choice when it comes to these. stores can be very messy at times and queue's are expected at the tills. then again you'll find that at most major stores at this time of year,4,Primark,trustpilot,2010-11-09
"Baseball shoe heel wears out in 2-3 weeks Because I'm a bit of a cheapstake, I buy 'Primarks' converse-style baseball shoes (they are around £8....but can sometimes be picked up in their end of stock sales for £2) These are nice comfortable trainers....but every pair I've bought wear out at the heel at around the 2-3 week mark (just from basic walking...no long treks) Does anyone else have this problem (or is it just me?)",2,Primark,trustpilot,2020-10-14
"DANGEROUS FAIRY LIGHTS BEWARE - DANGEROUS FAIRY LIGHTS
we bought our daughter some pink fairy lights from Primark. We heard a scream from her room and upon entering could smell a horrible burning smell. The fairy lights were billowing with smoke and I managed to put them out. If this had have happened whilst we were all asleep the outcome could have been catastrophic. We have contacted customer service but they seem fairly disinterested. Please get these out of your house if you have them",1,Primark,trustpilot,2017-11-02
Great customer service from gillian on… Great customer service from gillian on the tills at 8.40am this morning in the motherwell shop. She went the extra mile with her customer service.,5,Primark,trustpilot,2019-10-08
"Lack of thought & most definitely lack of effort Visited store today. My favourite shop.
Never needed to complain before?, clothes purchased,  thrown into bag!. Never in my life!.
Bit of thought and consideration?. Definitely effort.
Even in a Charity shop they are handled better than what I watched today!.
2/10.☹😡😡",2,Primark,trustpilot,2021-06-13
"Primark Oxford I'm writing two reviews in one.

5 ⭐⭐⭐⭐⭐ for the staff. I lost my daughter and they were straight on it. About 6 people were looking for her. 
Plus, while I was in line waiting to pay, the manager saw I was in a wheelchair and ushered me to the front to the disability check out.

1⭐ however is for the stores layout. By law there has to be enough space between clothing rails for a wheelchair to fit. But this wasn't the case. I had awful trouble trying to manoeuvre my way around.",3,Primark,trustpilot,2021-10-02
"Manchester store not very busy but 40… Manchester store not very busy but 40 minutes wait at the tills. Lots of staff on the shop floor chatting to each other, absolute joke, no regards for their customers.",1,Primark,trustpilot,2021-12-15
"Satisfied Considering the low prices I did not expect so much, but every product I have purchased has lasted long. I bought a coat which I am still using  after 8 years and looks as if it was new. I purchased t-shirts and even a pair of sneakers and they are in good shape. Compared to other low cost companies which are overpriced, Primark is quite ok.",4,Primark,trustpilot,2017-02-02
"rubbish Cheap and nasty. Poor quality clothing. Better off spending a bit more in other shops, you get what you pay for. Staff need training in customer service and need to realise they work in a cheap, scabby shop not a top end store.",1,Primark,trustpilot,2015-01-05
"Southend on sea store Staff in here are absolutely beyond rude and so un happy! Go and find a job that makes you happy or at least fake a smile.
Having worked in retail myself and various pubs I know how much of a nightmare it can be, but don't take it out on the customers that you can then risk losing and lose money.",1,Primark,trustpilot,2016-06-14
"always good never had issues, always find what I need great prices.",5,Primark,trustpilot,2017-02-10
"Primark Lakeside well were to… Primark Lakeside well were to start..... I want a pair of black jeans not super skinny not high waisted super skinny not super skinny ripped just BLACK JEANS not to be had..... Walked into the fitting room no one there so walked straight in until I hear ""excuse me you can't just walk in"" well where were you when I first walked in??? ""how many items do you have"" I have no idea I didn't know I needed to count on my way round!!!!! Wrong sizes on the wrong hangers so wanting to try on a 14 I am now trying to squeeze my fat ass into a size 8 seriously its not happening...... Shocking experience and will never go in there again",1,Primark,trustpilot,2021-08-07
"Cheap stuff, nothing more Good place to buy cheap stuff. But don't expect anything more. Better stores around.",3,Primark,trustpilot,2021-09-27
"Bought a pair of kids tights but chose… Bought a pair of kids tights but chose wrong size.Lost receipt due to christmas chaos.Just wanted to swap for bigger size .They refused point blank.Not like I wanted money back , just bigger size..Primark Shrewsbury..will put me off buying there again.",2,Primark,trustpilot,2021-01-02
Lost phone in Taunton store ..omg they … Lost phone in Taunton store ..omg they surpassed all expectations in there dedicated and efficient treatment of me ...posting staff in all areas of store I had been in ..and phoning repeatedly to see if they could locate no joy so they accessed the cctv and found me and followed my journey through store which ended in me being reunited with phone .. hallelujah 😀 thank you primark Taunton  !,5,Primark,trustpilot,2017-10-06
"Wasn't allowed to touch clothes I was in town 4 weeks ago and doing some shopping for myself. As ye do with picking clothes off the shelf to see the full look of it. This lassie comes over like ""excuse me you can't touch all the clothes due to covid19 you have to pick what you need im afraid"" ehhhh wit?? how the hell am i meant to grab what I need then if I can't see it in full because of being folded up. Unrealistic, 0 logic in her words. I waited till she walked away and I continued doing what I was doing. She ruined my experience in there and it annoyed me of how silly she actual sounded. Dont let staff control you with made up rules that clearly not in place. Cant touch clothing lol never heard such BS.",1,Primark,trustpilot,2020-10-09
"Good quality products, cues need work. Primark is a great store in which you can buy decent clothing at a decent price. They are very ethical with makeup and how they source their clothes and overall the quality is pretty amazing for the price. Had a few holes here and a few sizing issues there but Primark always seem happy to exchange or refund those items with my receipt.

I have seen many reviews complain about the policy, however the policy is there to cover their back from theft and people returning stolen goods. I also saw a comment asking why they don’t do e-receipts but I expect it is because of the immense cues in Primark. The cues are long and hot and bothering enough without making it longer by taking down email addresses and phone numbers. Just keep your receipts!! The stricter the policy, the better it is for Primark, no silly loopholes for dishonest people to jump through. 

Generally a great store and I shop here often. Air con could do with some work and the cues could be reduced with more staffing. Otherwise it would be a 5 star review :)",4,Primark,trustpilot,2019-07-08
"The most frustrating website in the world I love the bargains that Primark offers. In store, it is excellent for picking up some plain shirts or shoes at a crazy low price. However the website is truly terrible. Although there seems to have been some recent improvements, it is still relatively useless in comparison to other shopping sites. I fully understand that Primarks range is constantly changing, therefore updating the site must be a bit of a nightmare, but even if they didn't offer online shopping, they could perhaps offer showing ranges of what they offer so you know what to expect when going into the store.",2,Primark,trustpilot,2012-03-12
"Mmm - like a mad house well the experience in store at primark has never been great, but yesterday (12/01/15) in Manchester City Centre you wouldnt have believed the mess, clothes everywhere and the staff so miserable and unfriendly it made me walk out in protest and not buy anything. 



Ill have to build up my courage to go in another primark as its like fighting with cats and dogs for cheap t shirts and shoes  - over it  - off to another shop!",2,Primark,trustpilot,2015-01-13
Garbage for sale Its cheap prices are very cheap but quality is very bad.  Most items are garbage sizes are wrong.,1,Primark,trustpilot,2020-12-17
"Accused of stealing because my daughter… Accused of stealing because my daughter wanted to EXCHANGE a £6 top despite spending an additional £80 Tottenham Court Road this evening!
No receipt, but bank transaction on phone showed proof of purchase. Disgusting service by a supervisor called Emma!",1,Primark,trustpilot,2021-06-24
PRIMARK IS ONE OF MY FAVE STORES FOR VALUE FOR MONEY,5,Primark,trustpilot,2012-04-27
"False Economy Primark may be temptingly cheap but everything I have ever purchased from there has brought home the old adage, ""Buy Cheap, Buy Twice"".  I no longer shop there and prefer to save up for better quality versions.  The only way I could justify ever shopping there again would be when buying for babies / small children as the life span of their clothing is much shorter, making spending lots of money to buy them a waste.  Having said that the fact that their supply chain allegedly has some very questionable links (i.e. workers in developing countries not being paid a living wage by Primark sub-contractors in order to keep wholesale prices as low as possible) makes me feel uncomfortable about buying from there at all.",2,Primark,trustpilot,2012-02-13
Shop assistant Broughton park Sue helped me on finding a garment for my niece she was very helpful,5,Primark,trustpilot,2016-04-16
Music Bargin place to shop but please please can you play music in the stores?? The sound of clothes hangers clinking drives people mad lol,4,Primark,trustpilot,2019-02-13
"Rubbish quality!!! … Bought a shower curtain from primark and the quality is horrendous, water just goes straight through and wets the bathroom floor through 😒 won’t be buying again!!! Paid £8 and can get better quality ones for £3!!!",2,Primark,trustpilot,2021-06-12
crap rubish clothing exploting cheap third world labour !!!!!!,1,Primark,trustpilot,2012-01-04
I was in Romford primark today and got banned because of a friend that shoplifted I was in Romford primark today and my friend shoplifted and I was with her but I didn’t see her do it as me and my friends were walking out we got stopped and we all got banned because of one person I understand I was with my friend but that still doesn’t give them the right to ban me and my other friend when we did nothing wrong they could have atleast banned the friend that did it instead of banning all of us I am now banned for a year and I will definitely not be going there again after this experience,1,Primark,trustpilot,2021-06-30
Tamworth promark After friend had said Tamworth primark had opened and while standing in queue to get to tills people were social distancing as staff had checked people were distancing I decided to visit but was standing in queue for 40 mins with people standing less than 1 metre apart and no staff were going up and down saying anything about the queue or others walking around with masks stuck under chins I felt very unsafe and had to leave very disappointed as the shop looks great but not enough staff to make sure everyone is shopping safely,2,Primark,trustpilot,2021-05-04
My personal view on the store is if … My personal view on the store is if your looking to buy a dress that's $7 it's going to be cheap. The first fart you put in this thing your going to blow the a*s out. Probably not a god place to buy clothes,1,Primark,trustpilot,2017-04-02
"Great Value for Money No, it's not always pleasant to shop there, but great choice of products, great value for fashion fixes and essentials. 

Yes, sometimes, things do shrink in the wash, and some things are not as good as you would hope, but you get what you pay for.

I was very impressed during both my pregnancy, it was the only store where someone from the staff would make me jump the queues when I was heavily pregnant. I would not have expected it from this store, but none of the other stores did.",5,Primark,trustpilot,2012-06-03
"GREAT SHOP GREAT PRICES i love primarrk, there clothes and footwear are fab and i spend most of my money weekly buying things fromtheir shop, its good value for money xxxx",4,Primark,trustpilot,2012-07-12
"great for the quick pace of changing fashions Love it love it love it!!!! I always get what I'm looking for, and if it's not in Primark I don't want it....  People always compliment me on my outfits and are always shocked when tell them it's Primark and only cost ???",4,Primark,trustpilot,2011-12-12
Brilliant value for money Brilliant value for money. I was absolutely delighted with the formal shirts that I bought from Primark Manchester. Very good quality clothing and extremely helpful staff too. Would sincerely recommend to anyone.,5,Primark,trustpilot,2017-07-07
"Amazing SportsWear 10/10 I can honestly say Primark have the best sportswear to date. I say this as I'v been trying to find a decent pair of leggings for age, that high waited and shape lifting . I have ordered and tried on so many well known brands that are a lot more expensive but aren’t affective and I can definitely say Primark has beaten all the expensive sportswear brands. 

However, I will say it's a shame  they don't bring out new sportswear regularly, with the same material as the stretchy cotton fabric that's used for some of the leggings are really good. 
Highly recommend their sportswear for sure.

Great fit
Amazing figure shaping
Great Price 
Goof quality hold",5,Primark,trustpilot,2018-05-10
"I bought a pair of briefs I bought a pair of briefs , not even touched …..I legit got the wrong sizeeeeeee.The girls attitude in Blanchardstown Penney’s was sorry I can’t give you a refund .Bare in mind I continued to buy items and she couldn’t give me an exchange !!!!She said I can’t .I told her I’m disappointed and I think it’s a joke !! 
She didn’t say anything but told me price to pay and that was it !! Astonishing behaviour .Blanchardstown centre you must teach your staff to offer customer service !!! 
So unhappy with Penney’s !!!!",1,Primark,trustpilot,2021-12-15
"Craig at the West Bromwich store went… Craig at the West Bromwich store went above and beyond to help me. He delivered exceptional customer service providing the up most care. I was looking for a yellow snake print swimsuit. When he couldn't locate it on the shop floor, he checked the stockroom. When it wasn't available there he phoned the Birmingham store who had it in stock and reserved for me to collect. It's amazing that people that dedicated to serving customers still exist. I am happy I walked in that store and his colleagues should be proud to work alongside him. I couldn't have been happier with the service.",5,Primark,trustpilot,2019-07-31
"What a complete waste of a journey What a complete waste of a journey, I would have thought after being closed for so long that Primark would have been well stocked, but unless you want XS then your out of luck, most of the rails and shelves were empty in Rushden Lakes store, very disappointing.",1,Primark,trustpilot,2021-05-01
"Bought some bras from Primark (4) and… Bought some bras from Primark (4) and I’ve worn two but one strap on them is sown on correctly but the other strap is upside down so it digs in and really hurts my shoulders no matter how loose I have it. 
I would shop elsewhere but my skin is so sensitive that I’m actually allergic to places like boux next and bravissimo.
Really unhappy with them.",1,Primark,trustpilot,2019-01-13
PRIMARK GOOD SHOP LOVE THIS SHOP BUY ALL MY CLOTHES FROM HERE ITS BIT LIKE A JUMBLE SALE ONE I LIVE NEAR TO SO BIG AND ALWAYS PACKED OUT BUT STILL LOVELY CLOTHES FOR ME TO BUY DON'T LIKE CROWDS BUT LIKE THE SHOP BROUGHT SOME GOOD BARGAINS IN HERE NICE STAFF TO :),5,Primark,trustpilot,2011-10-08
"Depends on what you want to get out of… Depends on what you want to get out of it and how much you wanna invest in a product.. generally ok for many lines but occasionally the quality is not that good e.g. easily torn socks. 

Perfect for pyjamas",4,Primark,trustpilot,2020-11-04
"Great Prices Not being one to spend money, I appreciate Primarks cheap and affordable range.  I like the fact i can ge 10 times more clothes with what i would spend at any other store!",5,Primark,trustpilot,2012-05-01
"Poor quality but you get what you pay for I worked for them in 2007 for 4 months and they tell you how they don't buy from child sweat shops in foreign countries but staff that were opening boxes of clothes said they had bites from insects on their hands.



The shop was terribly unorganized and most of the staff didn't have a clue what they were there to do. On top of that a supervisor lost her temper with me because I asked her what should I do, after being sent from another floor that had no jobs for me to take care of, bitch.



After working there I really had no interest in shopping there but my Mother always informs me of how when she gets something from Primark it always seems to fall apart after the first wash.",2,Primark,trustpilot,2012-05-23
not that bad its cheap so its worth al the bad customer service,3,Primark,trustpilot,2018-01-30
Went to Cardiff store to exchange my… Went to Cardiff store to exchange my joggers were marked the wrong size had my receipt told me it not the right one but that’s the one in bag. In unpleasant fashion was very rude left joggers at till .,1,Primark,trustpilot,2020-11-22
Lovely service from older lady with… Lovely service from older lady with blonde hair in the bluewater branch.,4,Primark,trustpilot,2021-08-15
"Thanks kai an Dionna Great service from manager kai and sales person Dionna yesterday, who sorted my refund an subsequent purchases very seamlessly and professionally at Marble Arch primark store,security also very helpful as i entered store, an pointed me in right direction for tills, very professional and helpful, 2 other staff members also very helpful but cant remember their names seamless service many thanks😁👌",5,Primark,trustpilot,2021-12-14
PRICE PRICE PRICE Highstreet clothes at Primark Prices - what more can i say!,5,Primark,trustpilot,2012-02-10
Great gear. Good quality. Cheap prices. Don't see how anyone could fault primark. It gets better every time I go in there. Xmas jumpers for the cost of buttons.! Why go anywhere else?,5,Primark,trustpilot,2014-12-06
Cheap cheap cheap :) Cheap cheap cheap! OBVIOUSLY the clothes and shoes dont last long but that's why they are cheap so cannot expect to have clothes that lasts months when they are a couple of quid a piece,5,Primark,trustpilot,2020-10-20
"Nottingham store- awful VM member, lovely shop assistants I went to primark in Nottingham today and saw a hat in the window which was the last one available. I asked a lovely lady called Theresea (blonde, short hair, glasses) if she could see if I could have it which she did without hesitation. She then waited with me for 15 minutes whilst they contacted someone from VM. She was absolutely lovely and such an asset to primark! There was also another woman who was equally as lovely that I didn’t manage to get her name! Anyway 15 minutes later, a woman from VM (young, dark hair, short, I think her name could have been roxy but Theresa will know who it is) came down with a face like thunder, basically chucked the hat at me, didn’t smile or even acknowledge me! I don’t think I have ever seen someone be so rude!!!! Such a shame as the other two woman were the loveliest and if it wasn’t for them I would be writing an awful review. I think that VM woman needs a different job as clearly customer service isn’t something she specialisises in :)",2,Primark,trustpilot,2018-12-20
"Great Customer Service A big shout for Monika at Customer Support for Primark.  I was unable to get anyone to answer a phone in any of the stores which was frustrating, and Monika found the product I was after and arranged to have it reserved for me at the Wood Green branch.  She was most kind and efficient and I felt well looked after.  Thank you Monika, and I hope you get a big fat pay rise for your kindness and the brilliant way you did your job!

Cordelia",5,Primark,trustpilot,2020-01-29
great company love shopping with primark! brilliant shop.,5,Primark,trustpilot,2011-11-28
"Ealing Broadway) i was at the checkout… Ealing Broadway) i was at the checkout with an array of products, the first 'surprise' was that the jumper was not £5 as advertised in a big sign. in a cheap way they had written on the back of the sign 'all items individually priced'. It seems Primark are using Ryanair psychology to get the customers in. I am on benefits and every penny counts!The checkout girl then called this supervisor 'Sandra' who promptly marked off to the jumper section tucked away in a corner, I went with her sensing her severity. I said you have a sign here saying £5 (per jumper) and yet when you get to the check out its nearly £8. All I said its misleading (for the public)...she was having none of that, I said I think I am allowed to express my opinion (unless we are living in a fascist dictatorship?). She then turned nasty saying that she worked there from 8am-8pm, all I retorted was that I was allowed to express my opinion? She seems to think not and had already 'called security' (probably too many american movies) while I was back at the checkout. I left in disgust at her deeds and will never go to this store ever again. Talk about poor customer relations skills -appalling.Maybe this lady would have been happier living in ""the Reich"", for that is how she behaved. We should boycott stores like this with managers like this.",1,Primark,trustpilot,2018-07-05
"Woohoo Gift cards purchased online and posted to me I can't tell you how excited I was when I went onto the Primark site and saw you can purchase gift cards online. It means I have been able to do my Christmas shopping without leaving my cosy warm bed.  Thank you Primark for another brilliant idea, my kids are going to be super excited about the gift cards and I wasn't crushed by Christmas shoppers!  Needless to say whenever I do go into Primark i have always found the staff at my favourite store in Stockport friendly and helpful with lovely smiles and some happy conversations.",5,Primark,trustpilot,2013-11-26
"Listen to what customers are saying Primark!! Burton upon Trent store. Be very careful to keep your receipt when you purchase at this store. I bought 2 pairs of shorts for my grandson for our holiday but they were too tight, couldn’t find my receipt, took them back & got the next size up to exchange & no way would they exchange them! I would have understood if I’d been asking for my money back! I’ve now given them to a Charity Shop because I didn’t know what else to do! I even complained to the Head Office & was told it is not Company policy to exchange without a receipt! Very poor customer service. I won’t shop there again!",1,Primark,trustpilot,2019-06-30
"Stafford store - great shop I went to the Stafford store today with my daughter to do some Xmas shopping. I was chatting to the assistant by the changing rooms about the lovely range of new pyjamas. She was so friendly and helpful. We were talking about different location's and i commented that this was a nice sized store and always well laid out and tidy. When I complimented the store, she asked if I would consider giving them a review - so here it is!",5,Primark,trustpilot,2021-11-19
