text,rating,item_reviewed,publisher,date_published
"Embarassing experience I have always bought , and been pleased  with, my knickers in Primark. . On 9 March I bought 2 x 4 packs of my usual style / usual size small. On the Sunday following I opened one of the packs to put in my underwear drawer and straight away noticed the garments were much smaller than usual , and too small. The next day I breezed into the store ready to exchange, The girl at customer services advised me in curt tones ""We don't exchange underwear for hygeine reasons"" I pointed out to her the immaculate state of the packs I was returning and explained the reason why . After some further discussion she agreed to get a ""manager"". I went through the reason for requesting an exchange , and eventually someone turned up. I had to go through this whole explanation again and meanwhile the queue , which included men  , was building up behind me. No exchanges .. company policy and sizing information was on the reverse of the packs. She didn't want to know about the fact that these were supposed to be the same size/style as my previous purchases. However after standing my ground and some further discussion she agreed to the exchange but she was ""bristling"" the whole time. I did not notice that this policy  is explained on the reverse of the receipt , but honestly does anyone look at the receipt when you are being rushed through a busy till point, and it certainly wasn't pointed out. Also the point I was trying to make was that maybe there had been a mistake on the sizing in the manufacturing process which needed to be addressed. That fell on deaf ears. Anyway apologies for the essay . What I don't understand is why this Manager didn't take me, the awkward customer , aside and let the Customer Services staff get on with dealing with  the other people waiting. Clearly no management skills. Needless to say Primark have lost a customer. I will never shop there again.",2,Primark,trustpilot,2018-04-02
"Never had a problem Never had a problem 
Cheap and good for work
Most annoying thing is people yes costumers all like i-d-i-o-t-s running around and making damn mess!!!You think is a garbage shop?Dirty xxxxxxx",5,Primark,trustpilot,2021-04-14
"Disappointing in most areas Many tills but less than a third  actually had any staff member on them resulting in queues.

Queue & large groups of teenagers walking around store with no social distancing being and a high proportion of  customers wearing no masks or had any sign of exemption certificate on show.

Very very very limited stock of any size above a large.

Positive.
Great parking
Staff working hard to keep the store looking tidy & helpful when needing help.

Overall.
Ok but very short of what I expected both in size of store,  variation of stock & definitely in sizes available and this not just due to large sizes going first,  stock had just been put out and the piles of sizes for smaller sizes was huge, larger in single figures",2,Primark,trustpilot,2021-07-05
"Bought some items less than 28 days ago… Bought some items less than 28 days ago from primark in Aberdeen while I was on a day trip, tried to take two items back to my local primark in Gateshead both had tags still on and weren’t worn. Even with bank receipt my bank card, and time and date of purchase primark still refused to exchange these items my receipt was accidentally lost in transit while travelling. Extremely disappointed, by not allowing exchange when all evidence in presented of purchase to me in my opinion is theft simple as",1,Primark,trustpilot,2021-11-02
"If you live near primark Birmingham… If you live near primark Birmingham read this.

I currently have a noise complaint raised with Birmingham city council as primark have decided that it is acceptable to deliver to the front of their store usually between 21.45 and anything up to 01.00 the next morning 7 days a week. They have adequate loading bays at the rear of the store but apparently these lorries are to big for them?? 

They have showed no respect for the local residents in Birmingham city centre so we are currently perusing this through the council. It is impossible to get a full nights sleep due to the noise they create.  If any other residents on New St have a problem please get in contact.",1,Primark,trustpilot,2019-05-23
"total carp and getting expensive i used to love primark for work clothes & pj's.

whilst being poor quality and coming away after a few washes - they were cheap enough to throw them away.



like most other ""cheap"" companies, they have used price to build a good reputation, opened loads of stores, then started to hike the prices of their products.



i can now get better quality clothing and pj's for the same price, at a supermarket.",1,Primark,trustpilot,2012-01-27
"YESSS YES

Where else can you get a mug shaped like dumbo and super Mario onesie. This is by far and a way my favorite store. Note :
1. They will have basically every quirky / cute geeky item you want. Chip cup, poo bear pjs etc. 
2. While they are gorgeous and extremely cute, build quality isn't amazing. They won't / don't last long and you'll need to take care of them (about a year or max two for me). That being said, everything is also rather cheap so it evens up
3. Come prepared with approximately what you want to buy, and preferably during the week. The shop is usually very busy, crowded and massive so if you come during weekend and don't know what you're looking for you'll probably spend way too long and won't find much.",5,Primark,trustpilot,2019-08-10
love this store in Birmingham got some… love this store in Birmingham got some bargains,5,Primark,trustpilot,2019-06-21
"Largest Primark Birmingham Largest Primark Birmingham.  Well, it is large. Granddaughter and friend found lots I was looking for cotton/linen trousers tops, nothing doing. Disney cafe, staff really great. FOOD AWFUL. Tasteless, tepid, bland. The cheese and tomato flatbread tasted of nothing. I use stick to walk with and was so relieved at being able to go straight to the disable till I could have cried. Will visit again but eat elsewhere.",4,Primark,trustpilot,2020-01-02
"Absolutely love primark! Absolutely love primark!Such good quality clothing for such little price,most of my closet is from primark and I’ve had 3 of the exact same tops for 4 years,they r my live or die shirts,a definite place to shop if your looking for new clothes 100% would recommend 💗",5,Primark,trustpilot,2018-11-05
Decent price for clothing Decent price for clothing. Happy to spend the money on clothes designs which last a few weeks.,4,Primark,trustpilot,2019-04-12
"good value for money, but too warm inside! excellent value for money, even if a t-shirt lasts you a year, it only costs £2 so is value. would be good if everything could be made in the UK though. the only problem I have is the store is too warm and stuffy. I really feel sorry for the workers.",4,Primark,trustpilot,2012-06-05
"You expect it to be a dump when you… You expect it to be a dump when you walk into Primark and It never disappoints.
Let’s be honest Primark is a complete mess clothes all over the floor, people leaving foundation stains all over clothes, kids screaming, parents arguing and the store is boiling hot.
Quality of the clothing is not great probably won’t last more than a few washes. It’s great for short holidays and kids clothes because you either wear it abroad then throw it away or your kids grow so fast you wouldn’t waste your money anywhere else.
The clothes themselves are pleasent and on fashion definitely some gems buried beneath the crap.
Your always likely to find something cute worth buying! Always cheap prices!
Would reccomend if you don’t mind the havoc that is Primark.",3,Primark,trustpilot,2018-08-08
"Never buy luggage bags from Primark. Never buy luggage bags from Primark.

I bought luggage bag worth GBP42 from Wandsworth store and it did not even last me for 15 days, as one of its wheels came out. I called them and informed them and they said bring it back in the next 28 days, as stated on the receipt, and we would exchange it for you.
When I went back, I had the worth experience.
The store manager asked me to donate the bag to charity or ask my father/brother/bf to fix it for me (as if she had given the bag free of cost).

I emailed their customer care but they are equally bad at resolving customer issues. The bag did not even last me for 15-days. Under consumer act - 2015, it's an unsatisfactory product and unfit for purpose. Forget about exchange, Primark is not ready to fix it for me either.

Never the less, I purchased the bag for travel, so I will use it for travel and when people would enquire about missing/broken wheel, it would be my pleasure to narrate the poor customer service along with visual showcase of unsatisfactory quality products.",1,Primark,trustpilot,2019-03-07
Bought a pair of underwear and there… Bought a pair of underwear and there was a brown stain at the crotch area safe to say was not pleased by that.,1,Primark,trustpilot,2019-08-16
online u are unable to shop online,1,Primark,trustpilot,2011-11-13
"Primark Your prices are going up but the quality of your items are getting crap its over priced its no where near as cheap as it used to be and the clothing isnt even lasting as long as it should do or used to be so to me its asif its a bit money orintated 😁think about the money but not the stuff your selling 

And most primarks are starting to look like a bootsale having everything left everywhere wrong size hangers for the sized clothes sale items in the wrong place or damaged",1,Primark,trustpilot,2019-10-09
Amazing Pair of Jeans I bought jeans from them and i have used it since last 9 months and its of amazing quality. Really good stuff in good price.,5,Primark,trustpilot,2011-09-24
"Only home stuff is worth it Awful quality in clothing. Some things are never in stock, some things don't even reach all stores. if you ask about a different size they always say they don't have it because they don't feel like checking it. BODYSHAMING STAFF!",1,Primark,trustpilot,2017-07-19
Great! Not a bad place to shop! I’ve Brought clothes from here before and never had any problems.,4,Primark,trustpilot,2021-01-20
"Lack of respect for their staff I was recently shopping in the Burton on Trent Primark and overheard how a lady manager talked to some very young staff so much so that I went back to get her name, a Claire who really left a lot to be desired with her communication skills, clearly never heard of the idea of respect and getting the best out of their staff by talking to them nicely.",2,Primark,trustpilot,2016-09-18
"bad quality I have bought a bag in the primark, but after one day, the bag is already broken:(",1,Primark,trustpilot,2012-04-16
This company is totally amazing.. This company is totally amazing... went to primark in London amazing shop,5,Primark,trustpilot,2020-02-21
"lovely staff very polite and helpful lovely staff very polite and helpful. Disney baby clothes are very affordable and adorable, pjs from primark last longer than most pjs I’ve had for that price",5,Primark,trustpilot,2021-10-23
"Primark Hounslow Primark Hounslow 
Naomi, I believe, was a wonderful person who assisted me and my sister with everything and recommended things to us. 5 stars, Naomi!!! Keep up the good work!!!",5,Primark,trustpilot,2021-06-08
"I purchased on line a gift voucher for… I purchased on line a gift voucher for my niece's 50th Birthday, unfortunately I didn't realise that her size was not available in Primark.  However, Primark responded within an hour to my query of a refund and they were very understanding, a refund would be sent within 2 working days.  
This was an excellent result and much appreciated.  Thank you Kay",5,Primark,trustpilot,2020-10-26
Manchester store a joke Manchester store a joke! Queued at a 'buy' till to exchange a like for like product.. I had to go to customer services to do this.. My mistake entirely! Customer services... Slow and Disorganised.. Not enough staff. Queued for 25mins... People in front were 'buying' not exchanging or returning!! How is it not possible to exchange at a 'buy' till but you can take bags and bags to buy at the returns and exchange till!!,1,Primark,trustpilot,2019-06-25
"good value everyday clothes great service, helpful staff",4,Primark,trustpilot,2012-01-08
"Odd sizes and untidy stores I have bought cloths from here is only one size. The size i KNOW I am, however Primark clothing seems to disagree. I have tops which are massive and leggings which I was barely able to move my legs in, despite them saying they are a size larger than I am. 



Don't know whom they are measuring their sizes against but they certainly aren't British sizes.



Shop is usually very unorganised, with clothing strewn everywhere and some even trampled on. 



Queing is usually long and tiresome and I only go here on occasion.",3,Primark,trustpilot,2014-02-16
"Jogging trousers I recently had my prostate removed. I was told I should wear trousers with an elastic waist for comfort. My wife bought a pair of jogging trousers size medium. Well I have to tell you the only person to look comfortable in these would be the fat controller from Thomas the Tank engine, the inside leg measures 22"" and the distance from waist to crotch is 16"". I did of course write to customer services they told me that I should return them to their head office and they would possibly pay for a reasonable postage cost and refund me via a gift card. No detail about who to send them to, what refrence to use and no comment about the sizing. They are now ignoring my emailsI have now had time to consider my options, and despite extensive googling I find that your directors keep their heads down very well. So I will ask you very politely to respond to me with details as to how I can escalate my, now complaint. I will summarise how we have reached this stage.

I had an operation and needed some loose fitting trousers 

My Wife bought a pair of jogging trousers from Primark 

I found that the sizing and dimensions were completely wrong 

I wrote to you highlighting my issue 

You wrote back using a generic response, asking me to send the trousers back 

I asked you what was reasonable and what reference I should include with my return 

You wrote back saying post was fine and Primark would cover the cost 

I again asked how I should reference the return 

You did not respond 

I wrote again with an alternative solution 

I did also point out that your customer service was a bit lacking 

You have not responded or acknowledged the receipt of my email 

I have been polite in all of my correspondence 

I wrote to Paul Marchant, but his email bounced back 

I am now on a mission to have this matter resolved and will continue to press until it is 

Finally and most importantly Primark have now got £9 of my money and I have got a pair of trousers that are nothing like fit for purpose

I do look forward to hearing from you

 

Yours Sincerely",1,Primark,trustpilot,2014-09-03
In these tough times places like these… In these tough times places like these are really helpful. Have never faulted the prices and the quality has always been generally decent for me,4,Primark,trustpilot,2020-10-06
Stupid new returns policy Do not know why on earth they would change the returns policy!!! It’s a cheap clothing store trying to act like a designer brand. Why refuse a EXCHANGE with the tags and everything. ? Bore off,1,Primark,trustpilot,2020-01-18
"Louise on the upstairs till in the… Louise on the upstairs till in the Oxford Street , London branch went the extra mile and wrapped 22 mugs up in protective wrapping for me whilst smiling all the way. May thanks Louise for making my experience so good today during my lunch hour.",5,Primark,trustpilot,2018-09-28
"market stall not really that cheap anymore 

I find them as expensive as asda tesco newlook.

So no more Prida

Your paying the price

Shops are always in a mess",3,Primark,trustpilot,2012-01-16
brill well done one and all good job done,5,Primark,trustpilot,2011-12-13
"Lovely service from Jen on the till… Lovely service from Jen on the till upstairs at Primark Llandudno on 8/12/2020 ,very friendly helpful young lady x",5,Primark,trustpilot,2020-12-10
"Sladhy was very polite and was very kind and helpful I had went with my husband to primark in downtown around 420pm on Jan 5, 2019. My husband went to the 3rd floor fitting room. They were a young a lady who greeted us and was very polite. As she was in the front they were like 5 others employee just talking and being loud. As we have an accent it was very difficult for the young lady to understand us. Her name was really hard to pronounce, She told me the way you say it correclty so many time that I learned at the end. Sladhy was very patience, kind, and with smile on her face. As she tried to get my husband a sample shirt they were like 4 other people in line. None of the other employee helped her and she manage to help us and the rest of the customer. You are so lucky to have an employee like her.",4,Primark,trustpilot,2019-01-06
"To many people who don’t work in retail… l To many people who don’t work in retail leaving bad reviews. These girls who work here do not get enough recognition! They are human they serve you as fast as they can! Stop moaning about waiting and go shop somewhere else if you don’t like it! As for people not wearing masks what do you want the staff to do? Force them?! 

Absolutely love primark never got a bad word to say about them the staff are amazing! Don’t let nasty customers get you down girls these people know primark is always busy and still go and complain about waiting! Good on you all for doing such a great job❤️❤️❤️",5,Primark,trustpilot,2021-04-20
Southport Store ⭐️⭐️⭐️⭐️⭐️ We visited the Southport Store at the weekend. I wear a lanyard and information badge that informs people I have a hidden disability that makes me exempt from wearing a face covering. We queued outside and the man counting people going in noticed my lanyard and it’s significance and waved me through with all the other shoppers. Once inside staff also identified the lanyard and even asked if I needed any assistance. I was very nervous not knowing how people would react so Good Work Primark it was greatly appreciated.,5,Primark,trustpilot,2020-09-08
"I absolutely love this store, I absolutely love this store,, even if just to buy really handy clothes ( cheap and cheerful) 
I was served today with the utmost respect by Raj ( shop floor) and Yvonne ( till ) who both went out of their way to help me,,
Kind thoughtful and considerate!! 
What more can you want or indeed ask for from a high street retailer 
Perfect prices / perfect service/ perfect Xmas jumpers 👌
Thank you for your help guys 
👍👍👍",5,Primark,trustpilot,2018-11-10
"Bad quality messy store. Primark sell absolute rubbish & bad quality clothing, the shops are always like a tip with clothes strewn all over the floor & staff seem like they cannot cope, cheap but bad quality no thanks would rather pay more elsewhere for well known brands.",1,Primark,trustpilot,2020-11-19
Primark GOOD CLOTHES   FASHION  AND CHEAP,5,Primark,trustpilot,2011-06-20
The sizing is terrible The sizing is terrible I fit into pretty much every pj size there is. I'm generally a size 14 but I can fit into a 4 pj pants how does this make sense ? Bought a pair of jeans a week apart one fits fine the others dont there supposed to be the same size. You can get some great deals though and the staff are generally very nice I wish they'd stop moving everything around so much never know we're anything is.,3,Primark,trustpilot,2018-01-26
"An average experience A very badly managed store near Enfield, a complete mess, literally had to dig deep into a pile to find a t-shirt with no helpful assistance at hand. Very disappointing.",3,Primark,trustpilot,2016-08-09
"Some good finds but mostly trash tbh Some good finds but mostly trash tbh. Great for basics such as t-shirts and underwear, but otherwise it's a no.",3,Primark,trustpilot,2018-07-20
"Primark branch at Intu potteries Primark branch at Intu potteries, stoke on Trent - if you wear sizes 4 or 6 don’t bother going. Last 3 occasions I have been there is absolutely nothing in the ‘trending’ section in my size. What concerns me is they clearly aren’t ordering stock correctly because there are racks and racks of M, L, XL.",1,Primark,trustpilot,2020-10-25
"Cheap clothes, cheap materials! Primark has cheap clothes, but the material they are made of is also pretty bad, resulting in clothes that tear very easily. Good for buying clothes in a pinch or last minute, but for regular wear, stick to actual brands.",2,Primark,trustpilot,2018-12-13
"SKIP! Terrible clothes at cheap prices. Quality is equivalent to the price tag. If you want clothes for construction work or to tear quickly, buy them at primark. Other than that, avoid this like the plague.",1,Primark,trustpilot,2021-01-25
"Excellent I went to my local Primark in Southend on Sea today, I picked up a pair of sandals and when I went to pay the lady serving noticed a flaw on the sandals, she went and tried to find me another pair, but I had picked up the only ones in my size.  She then explained that I  could ring the store and find out when the sandals would next be in stock.  This was excellent customer service.  I work in the service industry myself and understand how good customer service has a positive affect on customers.  Thank you Lorna, an absolute star! Please ensure Lorna gets credit for her excellence today.",5,Primark,trustpilot,2019-06-07
"I bought some espadrilles from the… I bought some espadrilles from the Crawley branch they were a size 4 . .y feet have always been a 4 so I did not bother trying on. When I got home they were too small, so I put them in the bag with receipt to return the following week. Unfortunately Covid hit our household and we have been in isolation till today. Luckily they still had the sane shoes in store so I took to till to exchange. Spoke to supervisor who babbled on about 28 days. I explained I could not return as we had covid. She was very hostile towards me. I asked to see store manager who she intercepted on the way to prime her about my complaint. I told them I want happy so they td me to contact Head Office who isn't taking calls 🤬  All I wanted was ti exchange the shoes which are now in the sale, I have been through hell for the last month and this is how I am treated. I could understand it if I wanted a refund or to change for another style.",1,Primark,trustpilot,2021-07-07
"Okayy... Good website when you want to find out store opening times, phone numbers etc. But would be even better if they had a shop online option like all other high street stores. Or they could even just show new designs to 'look out for' in store.",2,Primark,trustpilot,2012-02-10
"Good value Hardly disspointed when I go in store I allways manage to find something I like.



Baby clothes have very off sizes I brought a 'dress' sized 18-23months to put away. My daughter had one wear out of it at 4months old - as a top! Wouldn't recommend for baby clothes.",5,Primark,trustpilot,2012-01-09
"Excellent Took  my 3 nieces here and gave them £50 each to spend for Christmas and birthday. They are over the moon. Yes not great quality but what do u want when u get a full basket for less than £50, kids grow quick so it doesn’t need to last yrs. Excellent value 😀",5,Primark,trustpilot,2019-12-09
"Fantastic customer service. me and my family went to the new primark in Birmingham and orders Disney t-shirts from there custom lab 
Unfortunately one was incorrect and not realised until home back in London, I called them they sent me the correct One no questions asked the person I spoke to was very kind and helpful. T-shirt arrived today with 12 mickey ears I thought the was a really lovely gesture and nice surprise 
Thank you 😊",5,Primark,trustpilot,2019-04-24
"Dreadful customer service I got 4 pairs of leggins from primark as a christmas gift but alas they didnt fit - as they were a gift i did not have receipt.
the items were unworn and still had all the labels attached
I tried to exchange these for the correct size but they were having none of it - they wouldnt even put it onto a gift card. So now i am left with 4 items that i cannot use - its not like I wanted a refund so not happy at all
The staff were very rude and unhelpul saying ""nothing i can do without a receipt so you need to find it""
the point is they were a gift and i dont have a receipt and all i wanted was to swap for the same items in a bigger size
disgraceful customer service!!!!
had to leave 1 star but in reality i give a minus 10",1,Primark,trustpilot,2019-01-05
Great customer service Delightful chap on the customer service department in Bury store. Very helpful,5,Primark,trustpilot,2016-03-30
"CARDIFF PRIMARK CARDIFF PRIMARK -Door woman refused to let me in despite no other customers around after I explained I have cancer of the blood and couldn't walk all the way round to the other side of the building to the entrance. She showed no humanity whatsoever, unbelievable. It's not the first time I've had issue with their security. Primark you need to remind them they are dealing with paying customers and show some consideration for disabled customers. She refused to give me her name but this was 12.45pm on 5/01/22.",1,Primark,trustpilot,2022-01-05
