text,rating,item_reviewed,publisher,date_published
Friend of mine bought me dress from… Friend of mine bought me dress from Primark I have never ever used Primark she lost receipt she asked me to go to Primark and change it I thought might as well change it for candles as I took dress without receipt to exchange it the illeterate people who work there said had I stolen the dress I was highly insulted in a cheap Trash store I stood there trembling the African mam working there took dress from my hand and no there was no blasted alarm going if the Morons working there had used their little brain to check video would have showed I had dress in my bag to exchange it I was going to bring the cheap Trash dress home and use it as a mop on my wooden floorboards my friend does buy me dresses to say I use their dresses whilst cleaning mopping my house I was highly insulted humiliated by such idiotic Morin's with half a brain who fail to check video evidence,1,Primark,trustpilot,2020-02-25
"I have been in touch with someone in … I have been in touch with someone in customer services for a week, and she just won't get back to me even though I have sent in a photo
about being overcharged! Her name is Francesca Sorrento, and I am disgusted  with her"" she should not be working here",1,Primark,trustpilot,2017-10-07
"Terrible Customer Service, Inflexible and Cheap! Was hoping to exchange a few items at primark, got to the till and found that I had lost the receipt, and was told I couldn't exchange without it. I offered proof of purchase with the transaction number and bank statement and still to no avail, contacted customer service and the same story. Guy was rude, no compassion or understanding, nothing. Told me I needed the receipt, copy and pasted the returns and exchange policy, and sent me on my way. Terrible customer service, I had three (unworn, brand new) items and all i needed to do was exchange all of them for one size up. Not asking for any money back. I wouldn't even have needed to do it had their dressing rooms been open. You think they might have been more understanding with the current situation. H & M will let you exchange anything, at any time and without having the receipt. Primark are a CHEAP company, selling CHEAP clothes, with CHEAP ethics.",1,Primark,trustpilot,2020-08-22
"Not going back felt very mistreated I have been into primark a few times  now and i feel i have a pretty good idea of what its about but on my most previous visit i was very disappointed and angry over the whole situation i went in nad found a few products i liked including a vassline nail cream that was advertised as £1 on a sign that seemed very clear and was infront of a vast amount of the product so i picked one up thinking great bargin. I joined the que after waiting there for a fair amount of time i went to register 7  and a woman scanned my products and i paid for them and walked away but then stopped and probably looked at my receipt then realised i had been charged £2; it wasn't the amount of money that they had charged me it was the principle so i went back less than a couple of seconds after i had paid and said to the lady "" i thought this product was £1"" she reluctantly took my recipt and scanned the product she said it came up as £2 but I insisted that it wasn't because of what the sign said ( the sign unlike other shops didn't have the name of the product, its number or a barcode just a simple £1 sign) after asserting myself she then got one of her colleges to go and check which took a while and i needed to catch a train she came back and persisted that it was £2 and it was a new range so she couldn't do anything about it. Feeling anoyed i asked for a refund I didn't want to give them my money when they had blatent disregard for me as a customer and she stated that she couldnt refund it and i had to go down to the customer survives and argue my point there so i still said "" but it was advertised as £1. By this time i had been there for so long with no help and just plain disrespect that I didn't have any time left to go down to customer services and have the same conversation i had just had for the last 10 minutes so I reluctantly had to leave it but i said on principle that i would not go back as i felt i was disrespected as a customer. So i am not very impressed with the overall primark experience and i will not go back!",1,Primark,trustpilot,2016-02-22
"We all know its cheap and saves us… We all know its cheap and saves us money, also Primark Northampton cashiers have always served with politeness and often with a smile. Sounds cheesy in this day n age BUT ITS TRUE. Love their CANDLES",4,Primark,trustpilot,2020-02-18
"Fed up Never any sizes in apart from xs.. never any super king bedding. 
Jumpsuits are made for tiny people . And we do not all want our belly out in every top !!",1,Primark,trustpilot,2021-06-19
"Primark The Fort Dunlop - Poor management Primark - The Fort Dunlop - As a customer I don’t appreciate hearing staff on the tills be threatened by the manager with the ultimatum “are you going to stay until 8.30pm today rather than 7.30pm? If you don’t then you won’t get any more extra hours.” Firstly, saying something like that when customers are being served is unprofessional. Secondly, how poorly managed must a store be to be putting staff into a situation like that? Overall, I think the store is obviously poorly managed and the management should be either retrained or taught how to manage a store and speak to their staff.",1,Primark,trustpilot,2019-01-05
I honestly love Primark I honestly love Primark. I match a lot of my more expensive clothing with clothing from Primark. It actually adds a little quirk to my outfits.  Bring the fussy shopper I am I love the variety.,5,Primark,trustpilot,2019-11-13
i have been buying underwear from… i have been buying underwear from primark for a few years. Decided to go buy some new knickers in my size i normally always get. The fabric and the fit of the knickers were so bad. They were supposed to be size 12-14 but they felt like size 8. Now I always wear size 10-12 clothes so they should of fit but they didn't. I wasted a lot of money on trying to get new underwear so was pretty disappointed when not a single pair would fit properly. sadly when underwear doesn't fit you can't get refunded either because of hygiene reasons. so I ended up losing quite a bit. I think next time I'll probably go sainsburies instead or somewhere else.,1,Primark,trustpilot,2019-09-30
Such great prices for everyday basic … Such great prices for everyday basic pieces. I just wish you could ship online,4,Primark,trustpilot,2017-06-26
"Shameful business conduct I bought a couple of items from the Ilford primark branch a week ago I wasn't able to try on in branch as due to covid changing rooms are closed, when I tried them on at home turned out I didn't like the fit anyway, when I went to do the refund I noticed that the receipt wasn't in the bag so I thought I'll just exchange it for something that does fit only to be told that without a receipt I can't do either even though the tags are still on the items and still in the same bag and the store manager told me that I would have to keep the items even though I can't make use of it!?? I went on to the primark website to find that, that indeed is the case its highly unethical for a company as big a s primark to essentially force customers to keep products that they can't make use of, that will be my last purchase from primark absolutely shameful business conduct!!!",1,Primark,trustpilot,2020-10-25
Primark Birmingham Monday 18/03/19 I can't speak highly enough of the service I received in Primark today! A manager by the name of Parm went above and beyond to give great customer satisfaction. Thank you Parm!,5,Primark,trustpilot,2019-03-18
better than any clothes shop i know you can afford to buy and throw them away the value is brilliant for up to the minute fashion daily clothes the lot we call it primani its clothes you can afford just as good as armani,5,Primark,trustpilot,2012-02-27
"Primark Meadowhall Sheffield Primark Meadowhall Sheffield

I went to return some boots I had bought from them 8 days ago, I had worn them twice and realised there was absolutely no support whatsoever in the shoe and that they scuffed so easily the quality must of been appalling.

They told me that because I had worn them I couldn't return them?

Well of course I have worn them, that's how I know the quality was unsellable and that they aren't right for me.

The employee serving me called a member of management over and instead of being professional and speaking to my face he hid in the back room with the employee and just shook his head - how rude.

Annoyed me so much as I work in retail and there is no way you should be rejected for a refund when you've hardly worn something.

Will not be going back - the fact I wasn't even offered a credit note of some kind rather than my money back. I got nothing - Not acceptable.",1,Primark,trustpilot,2018-01-11
"Terrible terrible company don’t even… Terrible terrible company don’t even deserve one star , completely lacking in customer care skills. Rude horrible staff , every time I have been in never had a good experience of interacting with staff. The head office isn’t much better. Clearly don’t care about their customers.",1,Primark,trustpilot,2021-07-14
Great prices but not good sizing!! Primark has great prices but their sizing leaves a lot to be desired. also their Stirling store is very bad for putting clothes on wrong size hangers!,3,Primark,trustpilot,2011-09-27
"Had to return several items to my local… Had to return several items to my local store in Southend on Sea. 
The sales assistant, and I use that term very loosly was really really rude. 
Checking every item I returned within an inch of its life. Completely unnecessary and a very degrading experience.
This is not the first time I have had such an experience with this specific person, so I would like to know how to put in a complaint against this person, as this sort of treatment is totally unacceptable and reflects terribly on your company if this is allowed to continue.",1,Primark,trustpilot,2018-07-17
"Primark is crap,crap quality,crap… Primark is crap,crap quality,crap service,crap crap crap.
Get up to date u crap store - have online receipts - u use factory workers to make profit, crap store. bad customer service - very slow and rude.",1,Primark,trustpilot,2018-03-30
"Good clothing with quality which atches the price Primark have some really trendy clothing which is easy on the eye. I bought a few pairs of jeans and t shirts. The jeans were £10 whilst £5 for a t shirt. Although the prices were dirt cheap, the quality wasn't the best however I didn't expect nothing better for such lower priced clothing. Would definitely recommend. 4*",4,Primark,trustpilot,2016-01-25
"Primark bluewater The store it self has a wide range of items and well stocked. The staff are polite and helpful.  The overall experience was positive, the only negative was how members of staff treat each other.
On this incident, i make the assumption the woman is in a supervisory role. The manner used to speak with her colleague was in an agressive and degrading way. Not pleasant  for anyone!!!",1,Primark,trustpilot,2019-11-24
"Products are great and good quality Products are great and good quality, really good price, staff are helpful and nice. Good service",5,Primark,trustpilot,2021-06-09
"Great range and low cost. The cost and range is super.so good that you always have to wait to pay,but it is worth it Mums Dads Kids all love it.",5,Primark,trustpilot,2012-04-18
"Zero stars in fact Zero stars in fact. I come in to buy clothes and when certain jeans , did not fit. I returned them, upon returning , I had encountered a female that was beside the cash register but on her phone distracted and very unprofessional. I asked where is the returns area, she just pointed in the direction to where all they had was one person on the counter, yet this Primark employee was blatantly on her phone, not helping other customers. It makes you wonder why they bother coming in to work. To be on their phones while at work and where people are watching her. Very unprofessional at best. Why come in to work. There are times and places for those things. Staff can be nice and helpful but this one took the biscuit. People like that should not have a job if they're there to get customers money that pay their wages. Disgraceful. Never again will I shop there and to complain directly , nobody is there. What's the world in clothing shops come to in this day and age while others work hard and try this female didn't even bother. Pathetic ...  This was in the Canterbury store UK.",1,Primark,trustpilot,2021-10-14
"Shocking and appalling customer service Shocking and appalling customer service.  Wouldn’t exchange an item despite unworn and proof when goods were purchased.  Was going to buy more items at the attempted time of exchange but left them on the counter because of their refusal to exchange. 
Store manager was very unhelpful and clearly shortsighted as they lost further sales. 
Would strongly recommend going elsewhere!!",1,Primark,trustpilot,2020-07-18
"Cheap Prices & Cheap site Whats the point of this site?

Not much is on here you can't view the clothes,bit of a waste of time really",2,Primark,trustpilot,2012-01-16
East Kilbride Primark. I went into Primark in East Kilbride Shopping Centre. I asked the girl at the Customer Service desk to keep my shopping for me for a few hours and I would come back for them. (As I have a sore back).  She said no Problem and put my name on them. I returned and she gave me my shopping saying I could pay for them with her (which saved me waiting in the queue). Her name was LOUISE. excellent Customer Care,5,Primark,trustpilot,2018-10-12
"Dan Hill Manager of the Watford branch … Dan Hill Manager of the Watford branch is very rude and the least helpful person you can wish to have dealings with. My wife purchased a pyjama set but the cashier charged her twice for it and didn't know how to refund, Not her fault she probably hasn't had the correct level of training. She called Dan hill over for help who said you will need to go to customer services. My wife said she wasn't going to queue for someone's mistake, Dan Hill took her over to do the refund. He passed it straight over to another assistant and left. The assistant did the refund but don't think understood was only one set. The items Was never put back in the bag. Wife got home to see wasn't there, Called Dan to be told he put it in the bag (He wasn't there) and you must of lost it (So my wife is a liar) Slander which I will take further with head office. He says he and a security guard checked the CCTV, so I would like head office to confirm this. He found the top but not the shorts. Thought he put them in the bag? I know its only a £10 item, But its calling my wife a liar that this point will be going further, as I think he needs customer dealing training as not a great example to staff. Not a single sorry for there mistake or half refund for the part they still have as we lost the shorts supposedly .Complained to head office who need up to 14 days to reply? Really? that many to deal with takes up to 14 days. Wow.",1,Primark,trustpilot,2017-09-07
"Went into Primark Uxbridge this morning… Went into Primark Uxbridge this morning and picked up a handbag for my mother. Stood in the queue ages where there was around 15 other people waiting to pay with only two cashiers open. I stood there and i stood there and still stood there when eventually i clocked these two members of staff having a mothers meeting at the other end of the cashier counter. I walked down there and passed one of them the handbag and said you have lost a sale due to your ignorance of not opening some more cashier desks, she calmly looked at me and said ""oh yea we should have shouldn't we"" and then carried on talking. 

I thought you paid your staff by the hour to work, not stand around infront of paying customers gas-bagging about Emmerdale.",1,Primark,trustpilot,2018-05-03
"Terrible customer service. Terrible customer service from bottom to top. Trying to return items purchased just before lockdown last year, kept getting told last day to return was end of jan; you were closed. First time I have been able to get to the store. Other companies have extended return policies to account for current circumstances. Not primark. Met with disregard and ambivalence. Even the manager, who refused to give his name, was saying yeah and what’s the issue. Shocking way to deal with customers. Even had to argue over the return of a faulty item. Have never experienced such bad customer service. Avoid.",1,Primark,trustpilot,2021-05-26
"Nottingham store. Nottingham store.

I am a mother of 3, 1 of whom is autistic.
My child with autism is stuck to me like glue so I never get to shop alone, which makes it difficult to browse because of my child's sensory processing disorder, it all gets to much for him.
Anyway, on One Saturday morning just a few weeks back my husband had convinced our son to stay home so mummy could shop, I haven't been shopping on my own in 6 years!!! Without my child.

I went to primark got in store about 8.30 9am
It was nice to browse, slowly anyway I got some of what I needed, paid then went and had breakfast and coffee in Costa (upstairs in primark) 
It was nice to sit back take my time relax and breath about an hour or so later I left leaving the main door and the security guard said on his radio suspect has left the shop, no one else was leaving.
I was fuming, I popped into the Works cone out and security guard and 2 members of staff all looking at me, I have never felt so uncomfortable.
I would never dream of stealing, let alone steal anything!
I did call the store and spoke with a guy who said he was a manager, (he could have been anyone) he did apologise and said would have a chat with him.

I have worked in Retail for 18 years and I would never make anyone feel that uncomfortable.
It's disgusting behaviour, and why if I was a suspect didn't he stop me if he thought I was stealing? 
I really should have took this complaint further than primark manager, I should have gone to the security firm he works for.",1,Primark,trustpilot,2021-12-30
Tried to exchange I had lost my receipt but the tags were still on the product. I was told that I could not exchange and I explained that the garment was to big. I told them that I cannot try the garment on in store so surely due to the circumstances we should be able to exchange. I was told again because I did not have a receipt they would not do this. I will not be shopping there again as other stores will still exchange.,1,Primark,trustpilot,2020-10-04
Wife loves it and it doesn't cost me… Wife loves it and it doesn't cost me much! Happy days!,4,Primark,trustpilot,2020-07-24
Whenever I go it’s always really clean Whenever I go it’s always really clean. I love their stuff. But I feel like whenever I get earphones they always break apart I have brought them 3 times and each time it they have gone apart,4,Primark,trustpilot,2019-06-17
"I like going here there are a lot of… I like going here there are a lot of good prices but I know a lot of it is bad quality but I still like to shop here, they also say on there website that they have stuff in stock when they don't.",4,Primark,trustpilot,2019-04-19
"Right i am pretty mad obviously i know… Right i am pretty mad obviously i know that its not entirely primarks fault but the fact they still stock it and its a SCAM! the sour patch kid and Cadburys chocolate pizza got it for my little brother and then later found out its just a bar of chocolate and some sour patch kids FOR SIX WHOLE POUNDS and that was when it was on half price its normally £12 when i could have got them separately for £2 at a supermarket DON'T BUY THIS ITEM !
but generally love most of the cloths i buy there they tend to last quite a long time at such a great price too",3,Primark,trustpilot,2021-12-07
"Love from the first sight Been there once during our Trip to Scotland. Men section customer service is so great! Girls helped me to choose the jeans I love so much now, amazing! Only one thing - I have noticed that women section is much bigger than men, so this is the only thing I would like to be right",4,Primark,trustpilot,2019-06-25
"Cheap but bad quality and frustrating experience in-store Cheap clothing but low quality, I'm not sure if it's even worth it. The Oxford Street store is huge but still it's hard to navigate because of the stupid amount of people ususally in there. For some reason a lot of customers are rude and careless, but I guess that is due to the ""horde"" feeling and that it's cheap, so they think who cares. For me it has been an utterly bad experience to shop in the Oxford Street store, so I'm not going back any time soon. Staff seems to be OK but it must be hell working there...",2,Primark,trustpilot,2014-10-25
"Perfect service! Was served by Heather* last night at the Haymarket store, Norwich at around 6 o'clock. Excellent customer service. Couldn't have been more helpful, polite and competent. She was very patient with me as I bought back several different items, some of which didn't have tags. There was quite a considerable queue waiting behind me however, she didn't seem to rush her time whilst speaking to me which made the wait worth it. I would definitely like to be served by her again. I actually offered to take part in the online customer service because I was that blown away by my experience. Thank you!",4,Primark,trustpilot,2014-08-01
Absolutely awful firm Absolutely awful firm. Tried to return an item which was defective (I actually wanted to return and pay for a more expensive item because the one I had bought was poor quaity and defective). They argued with me and when I complained to customer services lied to me about my consumer rights. I am now making a small claim. What a crappy firm.,1,Primark,trustpilot,2020-08-04
"Worst place ever to shop Worst place ever to shop 
Staff think they are paying for your items out there own pockets. 
Be very careful also as no receipt no exchanges now. 
Ask you day. Time. Card numbers what you bought etc. Otherwise no exchange. 
Shame on you as a company. You depend on the public. But your staff seriously need retrained.",1,Primark,trustpilot,2018-07-23
Good Many Harry Potter products bought online. Well received package with the products at the right size. Good experience for me.,4,Primark,trustpilot,2019-01-27
Great service Great service and helpful staff products prices are very good.Thank you,5,Primark,trustpilot,2021-01-15
"A management that blames the customer for their own mistake Before I was buying I confirmed with the staff member on the shop floor about the return policies and then I bought it.
Disappointment come when I was returning the items with the receipt from  Bullring Primark Birmingham, it was also purchased from same place. Instead of solving the issue the supervisor Dianna and Suri the sale-assistant calling customer a LIER and Guess what the item was only 2 days old. With all the original packages and tags and the items were not used. She wasn't taken it because the package was not in the PERFECT! condition. I was laughing at The supervisor Dianna, it showed how untrained she was the funny part was the supervisor followed what the sale-assistant said to her, she couldn't decide herself. When I asked for the manager, she changed the good after spoke with the manager. I worked in the retail for almost 4yrs and never called any customer a lier indirectly or directly. 
Primark certainly need to train their staff specifically their supervisors, this is not acceptable to call customers a LIER indirectly. We PAY for the good, not to be disrespected
worst customer service at the tell point by so-called supervisor and sale Assistant or sale consultant.",1,Primark,trustpilot,2019-09-14
"Do not visit Primark in Nottingham unless you are trying to catch COVID-19! Do not visit Primark in Nottingham unless you are trying to catch COVID-19!

I visited today (31 July 2020) and the shop was as busy as it ever is on a Friday, and approximately half of the customers and all of the staff were walking around without masks on.

I mentioned it to a member of staff and the security guard and both shrugged and said that there's nothing they can do - its only advisory...

No its not, IT'S THE LAW AND IT'S FOR EVERYONE'S SAFETY!!

Went in to make a definite purchase but I'll spend my money with a responsible retailer instead.

Plus, I went in Wilko after Primark and I only saw one person (in a large store) without a mask, so it wasn't the area or the demographic.  Well done Wilko!!",1,Primark,trustpilot,2020-07-31
Very very bad customer service in… Very very bad customer service in leicester store was spoken to in  a very unfriendly manner will never shop in that store again even the manger David spoke with disrespect May be a cheap store but no need to speak to your customers in the same manner,1,Primark,trustpilot,2019-02-05
